<?xml version="1.0" encoding="utf-8"?>
<spec xmlns="http://www.cs.cmu.edu/~pebbles/puc" xmlns:xsi="http://www.w3.org/2001/XMLSchema-instance" xsi:schemaLocation="http://www.cs.cmu.edu/~pebbles/puc puc.xsd" name="MitsubishiDVCR" version="PUC/2.2">
  <labels>
    <label>Mitsubishi DVCR</label>
  </labels>
  <types>
	<type type-name="OnOffType">
		<boolean/>
		<value-labels>
			<map index="false">
				<labels><label>Off</label></labels>
			</map>
			<map index="true">
				<labels><label>On</label></labels>
			</map>
		</value-labels>
	</type>
	<type type-name="YesNoType">
		<boolean/>
		<value-labels>
			<map index="false">
				<labels><label>Off</label></labels>
			</map>
			<map index="true">
				<labels><label>On</label></labels>
			</map>
		</value-labels>
	</type>
    <type type-name="InOutType">
		<boolean />
        <value-labels>
            <map index="true">
                <labels>
	                <label>In</label>
                </labels>
            </map>
            <map index="false">
                <labels>
		            <label>Out</label>
                </labels>
            </map>
        </value-labels>
    </type>
	<type type-name="ManualAutoType">
		<boolean />
		<value-labels>
			<map index="false">
				<labels>
					<label>Manual</label>
				</labels>
			</map>
			<map index="true">
				<labels>
					<label>Auto</label>
				</labels>
			</map>
		</value-labels>
    </type>
  </types>
  <groupings>
    <!-- States -->
    <group name="Base">
      <state name="Power" priority="10">
        <type>
          <enumerated>
            <item-count>3</item-count>
          </enumerated>
          <value-labels>
            <map index="1">
              <labels>
                <label>Off</label>
              </labels>
            </map>
            <map index="2">
              <labels>
                <label>Standby</label>
              </labels>
              <active-if>
                <greaterthan state="Recordings.Length">
                  <constant value="0" />
                </greaterthan>
              </active-if>
            </map>
            <map index="3">
              <labels>
                <label>On</label>
              </labels>
            </map>
          </value-labels>
        </type>
        <labels>
          <label>Power</label>
        </labels>
      </state>
      <group name="Status">
        <active-if>
          <equals state="Power">
            <constant value="true" />
          </equals>
          <greaterthan state="Setup.Progress">
            <!-- Setup has progressed beyond the initial steps -->
            <constant value="4" />
          </greaterthan>
        </active-if>
        <labels>
          <label>Status</label>
        </labels>
        <group name="Clock" priority="3" is-a="date-time">
          <state name="ClockSet">
            <type>
              <boolean />
              <value-labels>
                <map index="false">
                  <labels>
                    <label>Manual</label>
                  </labels>
                </map>
                <map index="true">
                  <labels>
                    <label>Auto</label>
                  </labels>
                  <active-if>
                    <equals state="FoundClockChannel">
                      <constant value="true" />
                    </equals>
                  </active-if>
                </map>
              </value-labels>
            </type>
            <labels>
              <label>Clock Set</label>
            </labels>
          </state>
          <group name="Time" is-a="time-absolute">
            <state name="Time">
              <type>
                <integer />
              </type>
              <labels>
                <label>Clock</label>
              </labels>
            </state>
            <state name="TimeZone">
              <type>
                <enumerated>
                  <item-count>7</item-count>
                </enumerated>
                <value-labels>
                  <map index="1">
                    <labels>
                      <label>Atlantic</label>
                      <label>GMT-4</label>
                    </labels>
                  </map>
                  <map index="2">
                    <labels>
                      <label>Eastern</label>
                      <label>GMT-5</label>
                    </labels>
                  </map>
                  <map index="3">
                    <labels>
                      <label>Central</label>
                      <label>GMT-6</label>
                    </labels>
                  </map>
                  <map index="4">
                    <labels>
                      <label>Mountain</label>
                      <label>GMT-7</label>
                    </labels>
                  </map>
                  <map index="5">
                    <labels>
                      <label>Pacific</label>
                      <label>GMT-8</label>
                    </labels>
                  </map>
                  <map index="6">
                    <labels>
                      <label>Alaska</label>
                      <label>GMT-9</label>
                    </labels>
                  </map>
                  <map index="7">
                    <labels>
                      <label>Hawaii</label>
                      <label>GMT-10</label>
                    </labels>
                  </map>
                </value-labels>
              </type>
              <labels>
                <label>Time Zone</label>
              </labels>
            </state>
            <state name="DaylightSavings">
              <apply-type type-name="YesNoType" />
              <labels>
                <label>Daylight Savings Time</label>
              </labels>
            </state>
          </group>
          <group name="Date" is-a="date">
            <state name="Month">
              <type>
                <enumerated>
                  <item-count>12</item-count>
                </enumerated>
                <value-labels>
                  <map index="1">
                    <labels>
                      <label>January</label>
                      <label>Jan</label>
                    </labels>
                  </map>
                  <map index="2">
                    <labels>
                      <label>February</label>
                      <label>Feb</label>
                    </labels>
                  </map>
                  <map index="3">
                    <labels>
                      <label>March</label>
                      <label>Mar</label>
                    </labels>
                  </map>
                  <map index="4">
                    <labels>
                      <label>April</label>
                      <label>Apr</label>
                    </labels>
                  </map>
                  <map index="5">
                    <labels>
                      <label>May</label>
                    </labels>
                  </map>
                  <map index="6">
                    <labels>
                      <label>June</label>
                      <label>Jun</label>
                    </labels>
                  </map>
                  <map index="7">
                    <labels>
                      <label>July</label>
                      <label>Jul</label>
                    </labels>
                  </map>
                  <map index="8">
                    <labels>
                      <label>August</label>
                      <label>Aug</label>
                    </labels>
                  </map>
                  <map index="9">
                    <labels>
                      <label>September</label>
                      <label>Sep</label>
                    </labels>
                  </map>
                  <map index="10">
                    <labels>
                      <label>October</label>
                      <label>Oct</label>
                    </labels>
                  </map>
                  <map index="11">
                    <labels>
                      <label>November</label>
                      <label>Nov</label>
                    </labels>
                  </map>
                  <map index="12">
                    <labels>
                      <label>December</label>
                      <label>Dec</label>
                    </labels>
                  </map>
                </value-labels>
              </type>
              <labels>
                <label>Month</label>
              </labels>
            </state>
            <state name="Year">
              <type>
                <integer>
                  <min>
                    <constant value="2000" />
                  </min>
                  <max>
                    <constant value="2099" />
                  </max>
                </integer>
              </type>
              <labels>
                <label>Year</label>
              </labels>
            </state>
            <state name="Date">
              <type>
                <integer>
                  <min>
                    <constant value="1" />
                  </min>
                  <max>
                    <constant value="31" />
                  </max>
                </integer>
                <value-labels>
                  <!-- I could bother with coding leap years in here, 
										but I won't. Instead I'm choosing to leave that
										up to the appliance. -->
                  <map index="30">
                    <labels>
                      <label>30</label>